{
  "id": "tawaf-circle",
  "type": "feature",
  "label": { "en": "Tawaf path", "ar": "مسار الطواف" },
  "geometry": {
    "inline": {
      "type": "LineString",
      "coordinates": [
        [39.8266, 21.4225],
        [39.82648, 21.42278],
        [39.8262, 21.4229],
        [39.82591, 21.42278],
        [39.8258, 21.4225],
        [39.82591, 21.42221],
        [39.8262, 21.4221],
        [39.82648, 21.42221],
        [39.8266, 21.4225]
      ]
    }
  },
  "render2d": { "shape": "line", "color": "#1f7a4d", "width": 2, "opacity": 0.8 },
  "themes": ["hajj"]
}
